{
  "schemaVersion": "1.0.0",
  "edgeMessageId": "11111111-1111-4111-8111-111111111111",
  "traceId": "22222222-2222-4222-8222-222222222222",
  "messageType": "telemetry.point.updated",
  "gatewayId": "gw-demo-01",
  "connectorId": "connector-mqtt-01",
  "sourceSystemId": "demo-bms-source",
  "tenantId": "tenant-demo",
  "projectId": "project-demo",
  "siteId": "site-demo-hq",
  "sampledAt": "2026-06-18T02:40:00Z",
  "receivedAt": "2026-06-18T02:40:01Z",
  "quality": "good",
  "payload": {
    "pointValue": 21.7,
    "unit": "C",
    "pointType": "temperature"
  },
  "metadata": {
    "protocol": "mqtt",
    "sourceTopic": "demo/telemetry/temp"
  },
  "assetCode": "ASSET-HVAC-01",
  "deviceCode": "DEV-AHU-01",
  "pointCode": "PT-TEMP-01",
  "idempotencyKey": "telemetry-tenant-demo-site-demo-hq-PT-TEMP-01-2026-06-18T02:40:00Z",
  "sourceSequence": 1001
}
